{
  "$schema": "https://ui.logic2b.com/schema/registry-version.json",
  "schemaVersion": 1,
  "version": "1.0.0-rc.6",
  "channel": "next",
  "releasedAt": "2026-08-29",
  "items": [
    {
      "name": "theme",
      "type": "registry:style",
      "title": "logic2b theme",
      "description": "The logic2b design system: monochrome oklch token ladder (light + dark), the 5-stop chart palette, 0.625rem radius, and Inter font wiring. Install this once so every component renders with the logic2b look.",
      "version": "1.0.0-rc.1",
      "registryVersion": "1.0.0-rc.6",
      "integrity": "sha256-lccfTDkVT1QAkPBHuEblUissl4BowDbVvF+gN6VLbcg=",
      "content": "/r/content/95c71f4c39154f540090f047b846e5522b2c978068c036d5bc5fa037a54b6dc8.json",
      "changelog": "/r/changelog/theme.json"
    },
    {
      "name": "use-mobile",
      "type": "registry:hook",
      "title": "useIsMobile",
      "description": "A React hook that tracks whether the viewport is below the mobile breakpoint (768px) via matchMedia. Used by sidebar and any responsive component.",
      "version": "1.0.0-rc.1",
      "registryVersion": "1.0.0-rc.6",
      "integrity": "sha256-CoVdEHGqfWPt8CoTRNhMqSwJ0C9nROFNxI9sYnEPRX0=",
      "content": "/r/content/0a855d1071aa7d63edf02a1344d84ca92c09d02f6744e14dc48f6c62710f457d.json",
      "changelog": "/r/changelog/use-mobile.json"
    },
    {
      "name": "utils",
      "type": "registry:lib",
      "description": "The cn() helper that merges Tailwind classes with clsx and tailwind-merge. Required by every component.",
      "version": "1.0.0-rc.1",
      "registryVersion": "1.0.0-rc.6",
      "integrity": "sha256-CBGmAr6zsnkELQSLEqq/vXR8EabLWi7Qg1vLpr4zzT8=",
      "content": "/r/content/0811a602beb3b279042d048b12aabfbd747c11a6cb5a2ed0835bcba6be33cd3f.json",
      "changelog": "/r/changelog/utils.json"
    },
    {
      "name": "button",
      "type": "registry:ui",
      "description": "Displays a button or a component that looks like a button. Variants: default, destructive, outline, secondary, ghost, link. Sizes: default, sm, lg, icon.",
      "categories": [
        "form"
      ],
      "version": "1.0.0-rc.2",
      "registryVersion": "1.0.0-rc.6",
      "integrity": "sha256-SuyOMZpldJ/NZ8bqCdZSxsMitlH+wNH4Gj1kVt4CqGo=",
      "content": "/r/content/4aec8e319a65749fcd67c6ea09d652c6c322b651fec0d1f81a3d6456de02a86a.json",
      "changelog": "/r/changelog/button.json",
      "accessibility": "/r/button.json#accessibility"
    },
    {
      "name": "card",
      "type": "registry:ui",
      "description": "Displays a card with header, title, description, action, content and footer sections.",
      "categories": [
        "data-display"
      ],
      "version": "1.0.0-rc.2",
      "registryVersion": "1.0.0-rc.6",
      "integrity": "sha256-cG1Urf8QSPhEzk1r2FDyQgZOIaYzXzBbwVhkNYT4yqo=",
      "content": "/r/content/706d54adff1048f844ce4d6bd850f242064e21a6335f305bc158643584f8caaa.json",
      "changelog": "/r/changelog/card.json",
      "accessibility": "/r/card.json#accessibility"
    },
    {
      "name": "input",
      "type": "registry:ui",
      "description": "Displays a form input field. Supports all native input types, file inputs, invalid state styling.",
      "categories": [
        "form"
      ],
      "version": "1.0.0-rc.2",
      "registryVersion": "1.0.0-rc.6",
      "integrity": "sha256-90LLxl7qsUsdRxJcfODOAilKQVP1aEGR+ez2eMzLoEM=",
      "content": "/r/content/f742cbc65eeab14b1d47125c7ce0ce02294a4153f5684191f9ecf678cccba043.json",
      "changelog": "/r/changelog/input.json",
      "accessibility": "/r/input.json#accessibility"
    },
    {
      "name": "label",
      "type": "registry:ui",
      "description": "Renders an accessible label associated with form controls, built on Radix Label.",
      "categories": [
        "form"
      ],
      "version": "1.0.0-rc.2",
      "registryVersion": "1.0.0-rc.6",
      "integrity": "sha256-pl08afFzvW68QOjmQzM0SaYDoq7gCTTlmivPPZXzepo=",
      "content": "/r/content/a65d3c69f173bd6ebc40e8e643333449a603a2aee00934e59a2bcf3d95f37a9a.json",
      "changelog": "/r/changelog/label.json",
      "accessibility": "/r/label.json#accessibility"
    },
    {
      "name": "badge",
      "type": "registry:ui",
      "description": "Displays a badge or a component that looks like a badge. Variants: default, secondary, destructive, outline.",
      "categories": [
        "data-display"
      ],
      "version": "1.0.0-rc.2",
      "registryVersion": "1.0.0-rc.6",
      "integrity": "sha256-1YC6FBACAy1prqs1/lT2gNrAlSWqCib2NjUDJLKXt6g=",
      "content": "/r/content/d580ba141002032d69aeab35fe54f680dac09525aa0a26f636350324b297b7a8.json",
      "changelog": "/r/changelog/badge.json",
      "accessibility": "/r/badge.json#accessibility"
    },
    {
      "name": "separator",
      "type": "registry:ui",
      "description": "Visually or semantically separates content, horizontal or vertical, built on Radix Separator.",
      "categories": [
        "layout"
      ],
      "version": "1.0.0-rc.2",
      "registryVersion": "1.0.0-rc.6",
      "integrity": "sha256-yRohvOrzXtUmPKdOftgbeP+KZEx2DlA0p+6NTSCWQzA=",
      "content": "/r/content/c91a21bceaf35ed5263ca74e7ed81b78ff8a644c760e5034a7ee8d4d20964330.json",
      "changelog": "/r/changelog/separator.json",
      "accessibility": "/r/separator.json#accessibility"
    },
    {
      "name": "item",
      "type": "registry:ui",
      "description": "A flex container for a title, description and actions, with media (icon/image) and grouping — for settings rows, notification lists, command results and any generic list of composite entries. Parts: Item (variant: default | outline | muted, size: default | sm), ItemGroup, ItemSeparator, ItemMedia (variant: default | icon | image), ItemContent, ItemTitle, ItemDescription, ItemActions, ItemHeader, ItemFooter.",
      "categories": [
        "data-display"
      ],
      "version": "1.0.0-rc.5",
      "registryVersion": "1.0.0-rc.6",
      "integrity": "sha256-MYhEaNgDNtn70+4Dt52S1zILbsPocnDruHEsTn7Q0hk=",
      "content": "/r/content/31884468d80336d9fbd3ee03b79d92d7320b6ec3e87270ebb8712c4e7ed0d219.json",
      "changelog": "/r/changelog/item.json",
      "accessibility": "/r/item.json#accessibility"
    },
    {
      "name": "avatar",
      "type": "registry:ui",
      "description": "An image element with a fallback for representing a user, built on Radix Avatar.",
      "categories": [
        "data-display"
      ],
      "version": "1.0.0-rc.2",
      "registryVersion": "1.0.0-rc.6",
      "integrity": "sha256-tKNJjmPxr8M8oYvGqYGrTviqfBZRnp9upVfKajYEvr4=",
      "content": "/r/content/b4a3498e63f1afc33ca18bc6a981ab4ef8aa7c16519e9f6ea557ca6a3604bebe.json",
      "changelog": "/r/changelog/avatar.json",
      "accessibility": "/r/avatar.json#accessibility"
    },
    {
      "name": "skeleton",
      "type": "registry:ui",
      "description": "Use to show a placeholder while content is loading.",
      "categories": [
        "feedback"
      ],
      "version": "1.0.0-rc.3",
      "registryVersion": "1.0.0-rc.6",
      "integrity": "sha256-Qvg1aYTBOV5PeCilbNM1PVcDuYmGgR7AagOzbuMG3qU=",
      "content": "/r/content/42f8356984c1395e4f7828a56cd3353d5703b98986811ec06a03b36ee306dea5.json",
      "changelog": "/r/changelog/skeleton.json",
      "accessibility": "/r/skeleton.json#accessibility"
    },
    {
      "name": "alert",
      "type": "registry:ui",
      "description": "Displays a callout for user attention with title and description. Variants: default, destructive.",
      "categories": [
        "feedback"
      ],
      "version": "1.0.0-rc.2",
      "registryVersion": "1.0.0-rc.6",
      "integrity": "sha256-Yfp82G/Fcd4yGmHil4snGheCbW7RzY1Zkj4JD+7cBXg=",
      "content": "/r/content/61fa7cd86fc571de321a61e2978b271a17826d6ed1cd8d59923e090feedc0578.json",
      "changelog": "/r/changelog/alert.json",
      "accessibility": "/r/alert.json#accessibility"
    },
    {
      "name": "textarea",
      "type": "registry:ui",
      "description": "Displays a form textarea that auto-sizes to its content (field-sizing).",
      "categories": [
        "form"
      ],
      "version": "1.0.0-rc.2",
      "registryVersion": "1.0.0-rc.6",
      "integrity": "sha256-eKmMg8RqkztVWsZYzS497w4MFd/t+O32EOEDw2jtPFw=",
      "content": "/r/content/78a98c83c46a933b555ac658cd2e3def0e0c15dfedf8edf610e103c368ed3c5c.json",
      "changelog": "/r/changelog/textarea.json",
      "accessibility": "/r/textarea.json#accessibility"
    },
    {
      "name": "accordion",
      "type": "registry:ui",
      "description": "A vertically stacked set of interactive headings that each reveal a section of content, built on Radix Accordion. Use it for FAQs or collapsible content groups. Parts: Accordion (root, supports type 'single' or 'multiple'), AccordionItem, AccordionTrigger, AccordionContent.",
      "categories": [
        "data-display"
      ],
      "version": "1.0.0-rc.2",
      "registryVersion": "1.0.0-rc.6",
      "integrity": "sha256-Fv2KuBcs7XiwlvuOcH0j/a31BoMip8uoB9ySvZQnVaw=",
      "content": "/r/content/16fd8ab8172ced78b096fb8e707d23fdadf5068322a7cba807dc92bd942755ac.json",
      "changelog": "/r/changelog/accordion.json",
      "accessibility": "/r/accordion.json#accessibility"
    },
    {
      "name": "collapsible",
      "type": "registry:ui",
      "description": "An interactive component which expands and collapses a panel of content, built on Radix Collapsible. Use it for simple show/hide sections without the multi-item semantics of an accordion. Parts: Collapsible (root), CollapsibleTrigger, CollapsibleContent.",
      "categories": [
        "data-display"
      ],
      "version": "1.0.0-rc.2",
      "registryVersion": "1.0.0-rc.6",
      "integrity": "sha256-jBQ7RXpASho5R0BQW0jf9xXZRV1Ie0WayLwcN3e5tH8=",
      "content": "/r/content/8c143b457a404a1a394740505b48dff715d9455d487b459ac8bc1c3777b9b47f.json",